{"decision_id":"PPR-DEC-EXAMPLE-001","run_id":"PPR-RUN-EXAMPLE-001","baseline_id":"PPR-BL-EXAMPLE-001","proof_id":"proof-v2","recommendation":"ready","finding_ids":["PPR-FND-EXAMPLE-001"],"correction_ids":["COR-EXAMPLE-001"],"fixity_event_ids":["PPR-EVT-EXAMPLE-001"],"rationale":"Accepted correction incorporated and reproof passed.","conditions":[],"signatory_role":"volume editor","signatory":null,"signed_at":null,"status":"recommendation_only","supersedes":null,"created_at":"2026-08-14T00:00:00Z"}
